{
  "schema_version": "evidence-corpus/v1",
  "corpus_id": "dayu-evidence",
  "course_id": "C-prequin-state",
  "lesson_id": "L101",
  "corpus_version": 1,
  "status": "sealed",
  "title": "L101 大禹治水正式证据库",
  "scope_note": "仅服务 C-prequin-state/L101 的精确发布。材料分为课程目标、传世文本、考古观察、学术解释与边界说明；角色回答不得越过当前片段，也不得把教学模型当史实。",
  "sources": [
    {
      "source_id": "src-allan-jishi",
      "title": "The Jishi Outburst Flood of 1920 BCE and the Great Flood Legend in Ancient China: Preliminary Reflections",
      "kind": "research",
      "author_or_institution": "Sarah Allan",
      "publisher": "Journal of Chinese Humanities",
      "published_year": 2017,
      "url_or_path": "https://doi.org/10.1163/23521341-12340041",
      "locator": "Vol. 3, Issue 1, pp. 23–34",
      "citation_note": "对自然事件与传说、夏史之间推论链的反思。",
      "reliability": "reviewed",
      "rights_note": "仅保存项目自写摘要和必要短引，课堂展示时保留出处；不复制受版权保护的整章内容。"
    },
    {
      "source_id": "src-chnmuseum-early-state",
      "title": "古代中国：夏商西周时期",
      "kind": "museum",
      "author_or_institution": "中国国家博物馆",
      "publisher": "中国国家博物馆",
      "published_year": null,
      "url_or_path": "https://www.chnmuseum.cn/portals/0/web/zt/gudai/detail2.html",
      "locator": "第一单元‘夏朝的建立’及经济部分",
      "citation_note": "公共机构关于早期国家与二里头主要遗存的说明。",
      "reliability": "reviewed",
      "rights_note": "仅保存项目自写摘要和必要短引，课堂展示时保留出处；不复制受版权保护的整章内容。"
    },
    {
      "source_id": "src-loc-yuji-map",
      "title": "Yu ji tu（禹迹图）",
      "kind": "museum",
      "author_or_institution": "美国国会图书馆",
      "publisher": "Library of Congress",
      "published_year": 1136,
      "url_or_path": "https://www.loc.gov/item/2021668264/",
      "locator": "1136年石刻地图拓本馆藏记录",
      "citation_note": "用于讨论南宋地理知识与大禹记忆。",
      "reliability": "reviewed",
      "rights_note": "仅保存项目自写摘要和必要短引，课堂展示时保留出处；不复制受版权保护的整章内容。"
    },
    {
      "source_id": "src-mengzi-tengwen",
      "title": "《孟子·滕文公上》",
      "kind": "primary_source",
      "author_or_institution": "传世文献；中国哲学书电子化计划底本索引",
      "publisher": "",
      "published_year": null,
      "url_or_path": "https://ctext.org/mengzi/teng-wen-gong-i/zh",
      "locator": "治水、疏河与三过家门相关段落",
      "citation_note": "战国论说语境中的后世记忆。",
      "reliability": "reviewed",
      "rights_note": "仅保存项目自写摘要和必要短引，课堂展示时保留出处；不复制受版权保护的整章内容。"
    },
    {
      "source_id": "src-moe-2022",
      "title": "义务教育历史课程标准（2022年版）",
      "kind": "curriculum",
      "author_or_institution": "中华人民共和国教育部",
      "publisher": "人民教育出版社",
      "published_year": 2022,
      "url_or_path": "https://www.moe.gov.cn/srcsite/A26/s8001/202204/t20220420_619921.html",
      "locator": "历史课程核心素养与学业质量要求",
      "citation_note": "用于适龄目标、证据意识和历史解释。",
      "reliability": "reviewed",
      "rights_note": "仅保存项目自写摘要和必要短引，课堂展示时保留出处；不复制受版权保护的整章内容。"
    },
    {
      "source_id": "src-ndrc-erlitou",
      "title": "中华文明总进程的引领者：二里头文化",
      "kind": "archaeology",
      "author_or_institution": "国家发展和改革委员会社会发展司",
      "publisher": "国家发展和改革委员会",
      "published_year": 2022,
      "url_or_path": "https://www.ndrc.gov.cn/xwdt/ztzl/dyhgjwhgy/202209/t20220920_1335799_ext.html",
      "locator": "二里头遗址与都邑布局部分",
      "citation_note": "机构性综合说明；更肯定的夏都措辞按解释层呈现。",
      "reliability": "reviewed",
      "rights_note": "仅保存项目自写摘要和必要短引，课堂展示时保留出处；不复制受版权保护的整章内容。"
    },
    {
      "source_id": "src-nopss-erlitou-layout",
      "title": "二里头都城布局的新发现及其意义",
      "kind": "archaeology",
      "author_or_institution": "赵海涛 / 中国社会科学院考古研究所",
      "publisher": "全国哲学社会科学工作办公室",
      "published_year": 2021,
      "url_or_path": "https://www.nopss.gov.cn/n1/2021/0208/c219544-32025885.html",
      "locator": "中心区道路、宫殿、作坊与等级结构",
      "citation_note": "考古工作者对可观察遗存和历史解释的区分。",
      "reliability": "reviewed",
      "rights_note": "仅保存项目自写摘要和必要短引，课堂展示时保留出处；不复制受版权保护的整章内容。"
    },
    {
      "source_id": "src-npc-civilization",
      "title": "中华文明起源与早期发展综合研究",
      "kind": "research",
      "author_or_institution": "中华文明探源工程相关研究团队",
      "publisher": "中国人大网",
      "published_year": 2023,
      "url_or_path": "https://www.npc.gov.cn/npc/c2/c30834/202309/t20230901_431407.html",
      "locator": "二里头与伊洛河流域部分",
      "citation_note": "用于年代、区域、宫城和高等级产品作坊概览。",
      "reliability": "reviewed",
      "rights_note": "仅保存项目自写摘要和必要短引，课堂展示时保留出处；不复制受版权保护的整章内容。"
    },
    {
      "source_id": "src-pep-seven-history",
      "title": "义务教育教科书·中国历史七年级上册目录与课程位置",
      "kind": "textbook",
      "author_or_institution": "人民教育出版社",
      "publisher": "人民教育出版社",
      "published_year": null,
      "url_or_path": "https://www.pep.com.cn/products/jc/czjks/201802/t20180227_1922743.shtml",
      "locator": "七年级上册早期国家相关单元",
      "citation_note": "仅用于主题与学段定位，不复制教材正文。",
      "reliability": "reviewed",
      "rights_note": "仅保存项目自写摘要和必要短引，课堂展示时保留出处；不复制受版权保护的整章内容。"
    },
    {
      "source_id": "src-science-jishi",
      "title": "Outburst flood at 1920 BCE supports historicity of China's Great Flood and the Xia dynasty",
      "kind": "research",
      "author_or_institution": "Qinglong Wu et al.",
      "publisher": "Science",
      "published_year": 2016,
      "url_or_path": "https://doi.org/10.1126/science.aaf0842",
      "locator": "Science 353 (6299), pp. 579–582",
      "citation_note": "积石峡洪水与夏史连接的原始研究，结论存在后续争议。",
      "reliability": "disputed",
      "rights_note": "仅保存项目自写摘要和必要短引，课堂展示时保留出处；不复制受版权保护的整章内容。"
    },
    {
      "source_id": "src-shangshu-yugong",
      "title": "《尚书·禹贡》",
      "kind": "primary_source",
      "author_or_institution": "传世文献；中国哲学书电子化计划底本索引",
      "publisher": "",
      "published_year": null,
      "url_or_path": "https://ctext.org/shang-shu/tribute-of-yu/zh",
      "locator": "九州、山川、贡赋相关文本",
      "citation_note": "文本层次和成篇问题需保留学术边界。",
      "reliability": "disputed",
      "rights_note": "仅保存项目自写摘要和必要短引，课堂展示时保留出处；不复制受版权保护的整章内容。"
    },
    {
      "source_id": "src-shiji-xia",
      "title": "《史记·夏本纪》",
      "kind": "primary_source",
      "author_or_institution": "司马迁；中国哲学书电子化计划底本索引",
      "publisher": "传世文献",
      "published_year": -90,
      "url_or_path": "https://ctext.org/shiji/xia-ben-ji/zh",
      "locator": "禹、治水、启继位相关叙事",
      "citation_note": "西汉成书，作为后世夏史叙事使用。",
      "reliability": "reviewed",
      "rights_note": "仅保存项目自写摘要和必要短引，课堂展示时保留出处；不复制受版权保护的整章内容。"
    }
  ],
  "passages": [
    {
      "passage_id": "dayu-p001",
      "source_id": "src-moe-2022",
      "title": "课程目标：从材料形成历史认识",
      "text": "本课依据义务教育历史课程的核心素养取向，引导学生辨认材料类型、建立时序空间观念，并用证据支持有边界的历史解释。",
      "summary": "课堂不是判断故事好不好听，而是练习材料—判断—边界的论证链。",
      "fact_ids": [
        "fact-c708f42f"
      ],
      "person_ids": [],
      "keywords": [
        "历史解释",
        "证据边界"
      ],
      "evidence_kind": "curriculum_goal",
      "certainty": "consensus",
      "chronology_note": "2022年公布的现代课程标准，用于教学目标而非古代事实。",
      "teaching_note": ""
    },
    {
      "passage_id": "dayu-p002",
      "source_id": "src-moe-2022",
      "title": "课程目标：理解早期国家",
      "text": "早期国家主题应把政治权力、社会组织和物质遗存联系起来，避免只背王朝名称与年代。",
      "summary": "用公共治理与二里头材料连接权力秩序和社会代价。",
      "fact_ids": [
        "fact-00b6a9f4",
        "fact-aafc4705"
      ],
      "person_ids": [],
      "keywords": [
        "公共动员",
        "早期国家"
      ],
      "evidence_kind": "curriculum_goal",
      "certainty": "consensus",
      "chronology_note": "现代课程目标。",
      "teaching_note": ""
    },
    {
      "passage_id": "dayu-p003",
      "source_id": "src-pep-seven-history",
      "title": "七年级内容位置",
      "text": "人民教育出版社七年级上册把夏商周与早期国家置于学生初次系统学习中国古代史的阶段；本课据此控制概念数量和阅读难度。",
      "summary": "课程身份属于七年级早期国家学习，不复制教材章节。",
      "fact_ids": [
        "fact-d4f1e760"
      ],
      "person_ids": [],
      "keywords": [
        "七年级",
        "早期国家"
      ],
      "evidence_kind": "curriculum_goal",
      "certainty": "consensus",
      "chronology_note": "现代教材目录和学段信息。",
      "teaching_note": ""
    },
    {
      "passage_id": "dayu-p004",
      "source_id": "src-shiji-xia",
      "title": "《夏本纪》的禹治水叙事",
      "text": "《史记·夏本纪》系统叙述鲧、禹与洪水治理，是理解秦汉以来夏史框架的重要传世文本；它的成书年代远晚于传统禹时代。",
      "summary": "可证明西汉史家如何组织禹的故事，不能单独证明现场细节。",
      "fact_ids": [
        "fact-98a8d039",
        "fact-bf990cb8"
      ],
      "person_ids": [
        "person-7c4825d9",
        "person-b40a4965"
      ],
      "keywords": [
        "传世文献"
      ],
      "evidence_kind": "transmitted_text",
      "certainty": "interpretation",
      "chronology_note": "《史记》成书于西汉，晚于传统所述事件约两千年。",
      "teaching_note": ""
    },
    {
      "passage_id": "dayu-p005",
      "source_id": "src-shiji-xia",
      "title": "禹后启继位的王朝叙事",
      "text": "《夏本纪》把禹、益与启的继承关系编入夏王朝开端，为后世讨论禅让与世袭转换提供了叙事框架。",
      "summary": "继承框架来自后世整理的王朝谱系。",
      "fact_ids": [
        "fact-6fe6c697"
      ],
      "person_ids": [
        "person-31118bee",
        "person-7c4825d9"
      ],
      "keywords": [
        "世袭",
        "权力秩序"
      ],
      "evidence_kind": "transmitted_text",
      "certainty": "interpretation",
      "chronology_note": "西汉文本对更早传统的整理。",
      "teaching_note": ""
    },
    {
      "passage_id": "dayu-p006",
      "source_id": "src-shiji-xia",
      "title": "公共责任的道德形象",
      "text": "后世夏史叙事突出禹长期在外、以公共事务为先的形象，形成影响深远的政治伦理记忆。",
      "summary": "道德记忆重要，但具体次数和对白不可考古核验。",
      "fact_ids": [
        "fact-d3d71c82"
      ],
      "person_ids": [
        "person-7c4825d9"
      ],
      "keywords": [
        "三过家门",
        "公共责任"
      ],
      "evidence_kind": "transmitted_text",
      "certainty": "legend",
      "chronology_note": "后世传承的英雄叙事，不是同时代工作日志。",
      "teaching_note": ""
    },
    {
      "passage_id": "dayu-p007",
      "source_id": "src-mengzi-tengwen",
      "title": "战国论说中的疏河",
      "text": "《孟子·滕文公上》以禹疏河、长期在外说明公共责任，把治水放进关于治理者职责的论辩。",
      "summary": "这段材料首先说明战国思想语境如何使用禹的形象。",
      "fact_ids": [
        "fact-34f9b1ba",
        "fact-f3213419"
      ],
      "person_ids": [
        "person-7c4825d9"
      ],
      "keywords": [
        "公共责任",
        "疏导"
      ],
      "evidence_kind": "transmitted_text",